{
  "schema_version": 1,
  "updated_at": "2026-10-10",
  "campaign": {
    "title": "Agent Memory Bench",
    "repository": "https://github.com/thomasfevre/agent-memory-bench",
    "principle": "Compare every memory boundary under an explicit dataset, context budget, reader, judge and repetition count.",
    "constraints": [
      "No paid API budget",
      "Synthetic or public data only",
      "Local models through Ollama where possible",
      "Subscription readers isolated from private files and tools",
      "Raw dataset and provider outputs remain local pending license and privacy review",
      "No universal aggregate leaderboard"
    ],
    "headline": "No system wins everywhere. Ingestion loss, temporal filtering, retrieval granularity and reader behavior can each reverse the ranking."
  },
  "workflow": [
    {
      "id": "source",
      "label": "Sources",
      "description": "Immutable documents, conversations, events and task trajectories."
    },
    {
      "id": "ingestion",
      "label": "Ingestion",
      "description": "Raw storage, LLM extraction, deduplication, temporal metadata and Context Shards."
    },
    {
      "id": "representation",
      "label": "Representation",
      "description": "Chunks, atomic facts, graphs, event logs, snapshots and temporal indexes."
    },
    {
      "id": "retrieval",
      "label": "Retrieval",
      "description": "Long context, BM25, MiniLM, hybrid fusion, routing and graph expansion."
    },
    {
      "id": "context",
      "label": "Context",
      "description": "Evidence recall, precision, temporal correctness, provenance and token budget."
    },
    {
      "id": "reader",
      "label": "Reader or agent",
      "description": "Local Qwen readers, isolated Codex readers and tool-using agents."
    },
    {
      "id": "judge",
      "label": "Verification",
      "description": "Exact and token metrics, paired tests, bootstrap, crash recovery and evidence audit."
    }
  ],
  "runs": [
    {
      "id": "jcode-targeted-tests-20260728",
      "date": "2026-07-28",
      "phase": "implementation",
      "dataset": "jcode repository",
      "task": "Memory, swarm, session, reload and persistence tests",
      "method": "Compiled Rust test binaries and full offline workspace suite",
      "reader": null,
      "evidence_level": "controlled",
      "sample": "119 targeted tests plus the full workspace suite",
      "repetitions": 2,
      "metrics": {
        "targeted_passed": 119,
        "targeted_total": 119,
        "workspace_exit_code": 101,
        "workspace_targets_still_failing_after_isolation": 12,
        "jcode_core_isolated_passed": 39,
        "jcode_core_isolated_total": 39
      },
      "budget": {
        "network": "offline"
      },
      "conclusion": "The memory and swarm components have substantial local implementation evidence, but the repository as a whole is not green.",
      "limitation": "Implementation tests do not establish end-to-end LLM quality.",
      "evidence_files": [
        "results/JCODE-COMMON-SMOKE-20260729.json"
      ]
    },
    {
      "id": "common-retrieval-20260729",
      "date": "2026-07-29",
      "phase": "retrieval",
      "dataset": "Synthetic common corpus",
      "task": "Evidence retrieval with temporal updates, rare exceptions, multi-hop and abstention",
      "method": "Eight aligned retrieval strategies",
      "reader": null,
      "evidence_level": "controlled",
      "sample": "28 documents, 18 reference facts, 20 questions",
      "repetitions": 3,
      "metrics": {
        "series": [
          {
            "method": "Long context",
            "recall": 1.0,
            "context_precision": 0.043,
            "temporal_correctness": 0.0,
            "latency_ms": 0.0,
            "mean_context_words": 282.0
          },
          {
            "method": "BM25",
            "recall": 0.921,
            "context_precision": 0.227,
            "temporal_correctness": 0.0,
            "latency_ms": 0.05,
            "mean_context_words": 52.1
          },
          {
            "method": "MiniLM dense",
            "recall": 0.974,
            "context_precision": 0.23,
            "temporal_correctness": 0.0,
            "latency_ms": 2.2,
            "mean_context_words": 54.2
          },
          {
            "method": "Hybrid",
            "recall": 0.974,
            "context_precision": 0.23,
            "temporal_correctness": 0.0,
            "latency_ms": 2.3,
            "mean_context_words": 54.6
          },
          {
            "method": "Dated facts",
            "recall": 0.895,
            "context_precision": 0.19,
            "temporal_correctness": 0.8,
            "latency_ms": 3.8,
            "mean_context_words": 35.0
          },
          {
            "method": "Dated graph",
            "recall": 0.921,
            "context_precision": 0.225,
            "temporal_correctness": 1.0,
            "latency_ms": 2.5,
            "mean_context_words": 34.8
          },
          {
            "method": "Type router",
            "recall": 0.947,
            "context_precision": 0.25,
            "temporal_correctness": 0.8,
            "latency_ms": 1.4,
            "mean_context_words": 39.0
          },
          {
            "method": "Parallel fusion",
            "recall": 0.974,
            "context_precision": 0.4,
            "temporal_correctness": 0.0,
            "latency_ms": 8.9,
            "mean_context_words": 44.2
          }
        ]
      },
      "budget": {
        "comparison_type": "diagnostic-not-equal-budget",
        "comparable": false,
        "top_k_non_long_context": 5,
        "long_context_documents": 28,
        "mean_context_words_reported": true
      },
      "conclusion": "Similarity maximizes broad recall, while explicit temporal filtering is required for current-state correctness.",
      "limitation": "The corpus is small and synthetic; temporal correction is evaluated on five cases, and context budgets differ across methods.",
      "evidence_files": [
        "results/COMMON-RETRIEVAL-COMPARISON-20260729.json"
      ]
    },
    {
      "id": "common-generation-qwen8-20260729",
      "date": "2026-07-29",
      "phase": "generation",
      "dataset": "Synthetic common corpus",
      "task": "Answer generation after aligned retrieval",
      "method": "Long context, hybrid, routed and parallel-fusion contexts",
      "reader": "qwen3:8b",
      "evidence_level": "controlled",
      "sample": "10 questions and 30 answers per architecture",
      "repetitions": 3,
      "metrics": {
        "series": [
          {
            "method": "Long context",
            "accuracy": 0.8,
            "tokens": 24315,
            "latency_s": 3.9
          },
          {
            "method": "Hybrid",
            "accuracy": 0.7,
            "tokens": 7917,
            "latency_s": 3.29
          },
          {
            "method": "Type router",
            "accuracy": 0.6,
            "tokens": 6654,
            "latency_s": 3.11
          },
          {
            "method": "Parallel fusion",
            "accuracy": 0.6,
            "tokens": 7509,
            "latency_s": 3.23
          }
        ]
      },
      "budget": {
        "answers_per_architecture": 30
      },
      "conclusion": "The stronger local reader used the full context best, despite substantially more noise and tokens.",
      "limitation": "This result reverses on larger and more distractor-heavy public data.",
      "evidence_files": [
        "results/PROTOTYPE-latest.json"
      ]
    },
    {
      "id": "topology-qwen17-20260729",
      "date": "2026-07-29",
      "phase": "agentic",
      "dataset": "Synthetic common corpus",
      "task": "Compare orchestration topologies under one reader",
      "method": "Single agent, pipeline, router, verification, retry and supervisor",
      "reader": "qwen3:1.7b",
      "evidence_level": "controlled",
      "sample": "8 questions",
      "repetitions": 3,
      "metrics": {
        "series": [
          {
            "method": "Single hybrid agent",
            "accuracy": 0.625,
            "calls": 24,
            "tokens": 6341,
            "latency_s": 1.07
          },
          {
            "method": "Lexical then dense pipeline",
            "accuracy": 0.625,
            "calls": 24,
            "tokens": 6420,
            "latency_s": 0.94
          },
          {
            "method": "Conditional router",
            "accuracy": 0.5,
            "calls": 24,
            "tokens": 5364,
            "latency_s": 0.85
          },
          {
            "method": "Double adversarial verification",
            "accuracy": 0.125,
            "calls": 72,
            "tokens": 23167,
            "latency_s": 6.24
          },
          {
            "method": "Verify then retry",
            "accuracy": 0.25,
            "calls": 72,
            "tokens": 22039,
            "latency_s": 4.24
          },
          {
            "method": "Three workers and supervisor",
            "accuracy": 0.5,
            "calls": 96,
            "tokens": 30706,
            "latency_s": 3.84
          }
        ]
      },
      "budget": {
        "questions": 8
      },
      "conclusion": "The more complex topologies did not improve quality and verification rejected correct answers too often.",
      "limitation": "Eight questions and one small reader do not characterize all multi-agent workloads.",
      "evidence_files": [
        "results/TOPOLOGY-latest.json"
      ]
    },
    {
      "id": "fact-extraction-20260729",
      "date": "2026-07-29",
      "phase": "ingestion",
      "dataset": "Synthetic common corpus",
      "task": "Atomic-fact extraction and temporal-window fidelity",
      "method": "Two local extractors",
      "reader": "qwen3:1.7b and qwen3:8b",
      "evidence_level": "controlled",
      "sample": "19 sources linked to 18 reference facts",
      "repetitions": 3,